{
  "version": "1.0",
  "company": {
    "company_id": "anthropic",
    "name": "Anthropic",
    "slug": "anthropic"
  },
  "card_set": "v3",
  "cards": [
    {
      "card_id": "v3_card_01",
      "title": "封面",
      "items": [
        {
          "field_key": "company_name",
          "label": "公司名称",
          "value": "Anthropic",
          "status": "confirmed",
          "confidence": 0.95,
          "evidence_count": 3,
          "source": "final"
        }
      ],
      "media": [
        {
          "asset_key": "logo",
          "url": "/assets/anthropic/logo.png",
          "status": "ready",
          "source": "selected_asset"
        }
      ],
      "layout": {
        "template_id": "v3_default",
        "variant": "wide"
      }
    }
  ],
  "warnings": []
}
